Job Title,Company,Location,Salary,Date,Job Link,Expire Date,Welfare,Job Description,Job Requirements,Job Level,Job Type,Experience,Industry,Min_Salary,Max_Salary,exp_min,exp_max,Translated Job Requirements,Soft Skills,Hard Skills,Domains
Chuyên Viên Mô Hình & Phân Tích Nâng Cao - Data Scientist - Modeling & Advanced Analytics - Khối Dữ Liệu (Ho25.43),Ngân Hàng Tmcp Quân Đội,Hà Nội,Cạnh Tranh,2025-03-16,https://careerviet.vn/vi/tim-viec-lam/chuyen-vien-mo-hinh-phan-tich-nang-cao-data-scientist-modeling-advanced-analytics-khoi-du-lieu-ho25-43.35C338F3.html,2025-04-18,"['Chế độ bảo hiểm', 'Du Lịch', 'Phụ cấp']","Phát triển các mô hình tín dụng (Mô hình điểm tín dụng, mô hình phân bổ hạn mức, Cảnh báo sớm…) và các mô hình, phân tích hỗ trợ quyết định khác Xây dựng các mô hình kinh doanh (Mô hình dự đoán khả năng mua hàng, mô hình dự báo khách hàng rời bỏ và mô hình bán chéo/tăng doanh số…) nhằm hỗ trợ chiến lược thu hút và giữ chân khách hàng Làm việc với các bộ dữ liệu lớn để khai thác thông tin và chuẩn bị dữ liệu sạch, có cấu trúc cho việc xây dựng mô hình Hợp tác với các thành viên trong nhóm để áp dụng các kỹ thuật máy học và các thực hành tốt nhất Đóng góp vào các dự án nghiên cứu sáng tạo, hợp tác với một trong những trường đại học hàng đầu thế giới nhằm khám phá các kỹ thuật mô hình mới.","Tốt nghiệp đại học chuyên ngành Khoa học Dữ liệu, Thống kê, Toán học, Khoa học Máy tính hoặc các ngành liên quan. Có từ 0-2 năm kinh nghiệm trong lĩnh vực phân tích, mô hình thống kê hoặc vai trò liên quan. Thành thạo các ngôn ngữ lập trình như Python, R hoặc SAS. Có khả năng sử dụng SQL, Spark vững chắc để trích xuất và xử lý dữ liệu. Có kiến thức về các kỹ thuật thống kê, máy học và mô hình dự đoán. Có kinh nghiệm với các nền tảng đám mây (AWS, GCP hoặc Azure) và các công nghệ dữ liệu lớn. Quen thuộc với các công cụ như Tableau hoặc Power BI để trực quan hóa dữ liệu. Bạn Nên Khám Phá Thêm: Chuyên viên cao cấp Mô hình hóa & Phân tích Nâng cao - Senior Data Scientist - Modeling & Advanced Analytics - Khối Dữ liệu (HOLT.08): https://tuyendung.mbbank.com.vn/tim-viec-lam/HOLT08/vi Chuyên viên, Chuyên viên Cao cấp Khoa học Dữ liệu - Data Scientist - Khối Dữ liệu (HO25.92): https://tuyendung.mbbank.com.vn/tim-viec-lam/HO2592/vi Chuyên viên, Chuyên viên Cao cấp Phân tích Khách hàng cá nhân - Data Analysis (Retail Banking) - Khối Dữ liệu (HO25.58): https://tuyendung.mbbank.com.vn/tim-viec-lam/HO2558/vi",Nhân viên,Nhân viên chính thức,Trên 1 Năm,"CNTT - Phần mềm , Ngân hàng , Tài chính / Đầu tư",21716056.0,31750014.0,1.0,5.0,"Graduated from university majoring in data science, statistics, mathematics, computer science or related industries.There are 0-2 years of experience in the field of analysis, statistical model or relevant role.Proficient in programming languages ​​like Python, R or SAS.Ability to use SQL, Spark solid to extract and process data.Knowledge of statistical techniques, learning machines and prediction models.Experienced with cloud platforms (AWS, GCP or Azure) and large data technologies.Familiar with tools such as TableAu or Power Bi to visualize data.You should discover further: Senior Senior Data Scientist - Modeling & Advanced Analytics - Data Block (Holt.08): https://tuyendung.mbbank.com.vn/tim-viec-lam/holt08/Vi Specialist, Senior Specialist Data Science - Data Scientist - Data Block (HE25.92):https://tuyendung.mbbank.com.vn/tim-viec-lam/ho2592/Vi Expert, Senior Application Analysis-Data Analysis (Retail Banking)-Data block (HO25.58): https://tuyung.mbank.com.vn/tim-viec-lam/ho2558/Vi",[],"['Power BI', 'Tableau', 'Statistics', 'Mathematics', 'SQL', 'AWS', 'Azure', 'Python', 'R', 'SAS']","['Banking', 'Computer Science', 'Retail']"
Chuyên Viên Phân Tích Dữ Liệu (Data Analyst),Công Ty Cp Iig Việt Nam,Hà Nội,Lên Đến 30 Tr Vnd,2025-03-24,https://careerviet.vn/vi/tim-viec-lam/chuyen-vien-phan-tich-du-lieu-data-analyst.35C350D1.html,2025-04-22,"['Laptop', 'Chế độ bảo hiểm', 'Du Lịch']","1. Thu thập và xử lý dữ liệu: - Thu thập, tổng hợp và phân tích dữ liệu từ nhiều nguồn khác nhau để hỗ trợ ra quyết định kinh doanh/ vận hành; - Kiểm tra, tổ chức và xử lý dữ liệu để đảm bảo tính chính xác, nhất quán. 2. Phân tích và dự báo: - Xây dựng và tối ưu các mô hình phân tích dữ liệu nhằm hỗ trợ đánh giá, dự báo xu hướng và đề xuất giải pháp chiến lược; - Đề xuất các cải tiến dựa trên kết quả phân tích dữ liệu nhằm tối ưu hóa quy trình làm việc và nâng cao hiệu quả hoạt động của tổ chức; - Xây dựng hệ thống báo cáo và trình bày kết quả: Tạo các báo cáo, truy vấn dữ liệu, tạo biểu đồ dashboard để trình bày kết quả của phân tích dữ liệu phục vụ quản lý - Tư vấn, hướng dẫn, phối hợp với các phòng ban liên quan để khai thác, quy hoạch, quản lý dữ liệu phù hợp với quy định quản trị dữ liệu; xác định yêu cầu báo cáo và tiêu chí đánh giá dữ liệu. 3. Phát triển và cải tiến hệ thống: - Tham gia phát triển, cải tiến các công cụ, hệ thống đo lường và quy trình phân tích dữ liệu; - Xây dựng tài liệu hướng dẫn, quy trình chuẩn hóa về phân tích và xử lý dữ liệu.","1. Trình độ: - Tốt nghiệp Đại học chuyên ngành Kinh tế, Khoa học dữ liệu, Thống kê, Toán ứng dụng, CNTT hoặc các ngành liên quan; - Sử dụng thuần thục Microsoft Office, các công cụ liên quan đến báo cáo dashboard; - Ưu tiên sử dụng được tiếng Anh. 2. Kinh nghiệm: - Từ 03 năm kinh nghiệm làm việc trong lĩnh vực Phân tích dữ liệu hoặc các vị trí liên quan. 3. Kiến thức: - Thành thạo các công cụ phân tích dữ liệu như SQL, Python, Excel (Pivot Table,Power Query, VBA) & PowerBI. 4. Kỹ năng: - Khả năng lập kế hoạch và quản lý, xử lý công việc hiệu quả; - Khả năng tư duy logic, phân tích số liệu và giải quyết vấn đề tốt; - Kỹ năng giao tiếp, làm việc nhóm/điều phối, thiết lập mối quan hệ trong công việc. *** Quyền lợi: - Mức lương: Upto 30 triệu gross/ tháng (thỏa thuận theo năng lực). Mức lương thử việc: 90% mức lương chính thức (02 tháng thử việc); - Điều chỉnh lương: 1 năm/ 1 lần; - Chế độ thưởng Lễ, Tết & thưởng cuối năm căn cứ vào đánh giá cá nhân và tình hình kinh doanh của công ty; - Bảo hiểm: Tham gia BHXH, BHYT, BHTN theo quy định của Pháp luật; - Chế độ khám sức khỏe định kỳ: 1 năm/ 1 lần; - Ngày phép: 12 ngày phép/ năm và quy đổi phép dư thành tiền mặt; - Phúc lợi: Du lịch hàng năm, Team building, Sinh nhật, Ốm đau, hiếu hỉ, ngày lễ, ... - Sự kiện nội bộ hấp dẫn mang đậm màu sắc văn hóa doanh nghiệp: 8/3, 20/10, 20/11, Recharge With IIG (1/6), Trung thu, Halloween, Year End Party,... - Chương trình đào tạo Cán bộ nguồn và các chương trình đào tạo nội bộ khác; - Chính sách hỗ trợ giá khi sử dụng sản phẩm của Công ty. Lưu ý: Do số lượng lớn CV đổ về từ các nguồn tuyển dụng,Team Tuyển dụng xin phép chỉ liên hệ với ứng viên phù hợp trong khoảng 3-5 ngày làm việc.",Nhân viên,Nhân viên chính thức,3 - 5 Năm,"Nhân sự , Thống kê",21716055.71942446,30000000.0,3.0,5.0,"1. Level: - Graduated from university majoring in Economics, Data Science, Statistics, Mathematics, IT or related industries;- Floating Microsoft Office, tools related to Dashboard reports;- Priority to use English.2. Experience: - From 03 years of experience working in the field of data analysis or related positions.3. Knowledge: - Proficient in data analysis tools such as SQL, Python, Excel (Pivot Table, Power Query, VBA) & Powerbi.4. Skills: - Ability to plan and manage and handle work effectively;- Logic thinking ability, data analysis and good problem solving;- Communication skills, teamwork/coordination, establishing relationships at work.*** Benefits: - Salary: UPTO 30 million Gross/ month (Agreement according to capacity).Probationary salary: 90% of the official salary (02 months of probation);- Salary adjustment: 1 year/ 1 time;- The regime of rewarding ceremony, New Year & Bonus at the end of the year based on the personal assessment and business situation of the company;- Insurance: Participating in social insurance, health insurance and unemployment insurance as prescribed by law;- Periodic health examination regime: 1 year/ 1 time;- Date of magic: 12 days/ year and conversion of surplus into cash;- Welfare: Annual travel, team building, birthday, sickness, filial piety, holidays, ... - Attractive internal events with bold corporate culture: March 8, October 20, November 20, Recharge with Iig (1/6), Mid -Autumn Festival, Halloween, Year End Party, ... - Source staff training program and other internal training programs;- Price support policy when using the company's products.Note: Due to the large number of CVs from recruitment sources, the recruitment team asks for permission to contact the candidate for appropriate candidates in about 3-5 working days.","['Communication', 'Team Building']","['Dashboard', 'Statistics', 'Mathematics', 'SQL', 'Excel', 'Python', 'VBA']","['Economics', 'Insurance', 'Insurance', 'Insurance', 'Insurance', 'Law', 'Recruitment', 'Recruitment']"
Senior Data Analyst - Xây Dựng Hệ Thống Bi Portal,Công Ty Cổ Phần Anvy,Hà Nội,30 Tr - 47 Tr Vnd,2025-03-08,https://careerviet.vn/vi/tim-viec-lam/senior-data-analyst-xay-dung-he-thong-bi-portal.35C31F5E.html,2025-04-06,"['Chế độ bảo hiểm', 'Du Lịch', 'Phụ cấp']","Xây dựng và phát triển hệ thống BI Portal Thu thập yêu cầu nghiệp vụ từ các phòng ban, chuyển hóa thành báo cáo BI và dashboard trực quan trên các công cụ như Power BI, Looker, Tableau . Xây dựng kho dữ liệu lớn. Tổ chức, tổng hợp dữ liệu từ các hệ thống khác nhau (bán hàng, DMS, kế toán...) vào hệ thống kho dữ liệu này thông qua API hoặc các công cụ khác. Tối ưu hóa quy trình ETL (Extract - Transform - Load) và đảm bảo hệ thống dữ liệu hoạt động chính xác, ổn định. Đề xuất các giải pháp công nghệ phục vụ triển khai hệ thống BI Phân tích dữ liệu và cung cấp insight Phân tích chuyên sâu các dữ liệu có ý nghĩa liên quan đến bán hàng, sản phẩm, phân khúc, đối tượng khách hàng nhằm hỗ trợ chiến lược kinh doanh. Xây dựng mô hình phân tích dự báo, đánh giá hiệu suất kinh doanh và cung cấp các báo cáo chuyên sâu cho lãnh đạo. Sử dụng Python để xử lý, phân tích và khai thác dữ liệu lớn hiệu quả. Vai trò BA - Thu thập và phân tích yêu cầu dữ liệu Làm việc trực tiếp với các bộ phận để xác định nhu cầu phân tích dữ liệu và đề xuất giải pháp BI phù hợp. Phân tích và chuẩn hóa yêu cầu để tích hợp dữ liệu giữa các hệ thống riêng lẻ và hệ thống dữ liệu chung của doanh nghiệp. Ứng dụng công nghệ và AI (Ưu tiên) Xây dựng mô hình dự đoán xu hướng về doanh thu, hành vi khách hàng, tồn kho, giá cả sản phẩm, giúp doanh nghiệp ra quyết định kịp thời và chính xác.","Trình độ học vấn: Tốt nghiệp đại học chuyên ngành Hệ thống thông tin/Công nghệ thông tin, Toán thống kê, hoặc các lĩnh vực liên quan. Kinh nghiệm làm việc: Tối thiểu 3-5 năm kinh nghiệm trong lĩnh vực Data Analysis và xây dựng hệ thống BI Portal. Có kinh nghiệm tổ chức và tích hợp dữ liệu từ nhiều nguồn khác nhau vào cơ sở dữ liệu chung. Có khả năng làm việc như Business Analyst (BA) , thu thập yêu cầu và chuyển hóa thành giải pháp phân tích dữ liệu. Kỹ năng và kiến thức chuyên môn: Thành thạo các công cụ phân tích và trực quan hóa dữ liệu như: Power BI, Tableau, Looker . Kỹ năng lập trình Python, excel để xử lý và phân tích dữ liệu. Hiểu biết về API và quy trình ETL để tổ chức và tích hợp dữ liệu từ nhiều hệ thống. Kỹ năng phân tích dữ liệu chuyên sâu, cung cấp insight về bán hàng, sản phẩm, khách hàng . Ưu tiên: Có hiểu biết về AI và khả năng xây dựng mô hình dự đoán các xu thế về doanh thu, tồn kho, khách hàng và giá cả sản phẩm là một lợi thế lớn. Yêu cầu khác: Kỹ năng giao tiếp, tư duy logic và giải quyết vấn đề tốt. Tinh thần làm việc độc lập và khả năng phối hợp nhóm hiệu quả.",Nhân viên,Nhân viên chính thức,3 - 4 Năm,"CNTT - Phần cứng / Mạng , CNTT - Phần mềm , Thống kê",30000000.0,47000000.0,3.0,4.0,"Education level: Graduated from university majoring in information/information technology, statistical math, or related fields.Work experience: At least 3-5 years of experience in the field of data Analysis and building a Portal Bi system.Experience in organizing and integrating data from many different sources into the general database.Able to work as Business Analyst (BA), collect requirements and transform into data analysis solutions.Skills and professional knowledge: Proficient in data analysis and visualization tools such as: Power Bi, TableAu, Looker.Python, Excel programming skills to process and analyze data.Understanding API and ETL process to organize and integrate data from multiple systems.Intensive data analysis skills, providing insight for sales, products, customers.Priority: AI knowledge and ability to build a model of predicting trends in revenue, inventory, customers and product prices are a great advantage.Other requirements: Communication skills, logical thinking and good problem solving.The spirit of working independently and the ability to coordinate the group effectively.",['Communication'],"['Looker', 'Power BI', 'Tableau', 'ETL', 'Excel', 'Python']","['Education', 'Information Technology', 'Inventory', 'Sales', 'Technology']"
Senior Data Analyst - Xây Dựng Hệ Thống Bi Portal,Công Ty Cổ Phần Anvy,Hà Nội,30 Tr - 47 Tr Vnd,2025-03-21,https://careerviet.vn/vi/tim-viec-lam/senior-data-analyst-xay-dung-he-thong-bi-portal.35C3765F.html,2025-04-07,"['Chế độ bảo hiểm', 'Du Lịch', 'Phụ cấp']","Xây dựng và phát triển hệ thống BI Portal Thu thập yêu cầu nghiệp vụ từ các phòng ban, chuyển hóa thành báo cáo BI và dashboard trực quan trên các công cụ như Power BI, Looker, Tableau . Xây dựng kho dữ liệu lớn. Tổ chức, tổng hợp dữ liệu từ các hệ thống khác nhau (bán hàng, DMS, kế toán...) vào hệ thống kho dữ liệu này thông qua API hoặc các công cụ khác. Tối ưu hóa quy trình ETL (Extract - Transform - Load) và đảm bảo hệ thống dữ liệu hoạt động chính xác, ổn định. Đề xuất các giải pháp công nghệ phục vụ triển khai hệ thống BI Phân tích dữ liệu và cung cấp insight Phân tích chuyên sâu các dữ liệu có ý nghĩa liên quan đến bán hàng, sản phẩm, phân khúc, đối tượng khách hàng nhằm hỗ trợ chiến lược kinh doanh. Xây dựng mô hình phân tích dự báo, đánh giá hiệu suất kinh doanh và cung cấp các báo cáo chuyên sâu cho lãnh đạo. Sử dụng Python để xử lý, phân tích và khai thác dữ liệu lớn hiệu quả. Vai trò BA - Thu thập và phân tích yêu cầu dữ liệu Làm việc trực tiếp với các bộ phận để xác định nhu cầu phân tích dữ liệu và đề xuất giải pháp BI phù hợp. Phân tích và chuẩn hóa yêu cầu để tích hợp dữ liệu giữa các hệ thống riêng lẻ và hệ thống dữ liệu chung của doanh nghiệp. Ứng dụng công nghệ và AI (Ưu tiên) Xây dựng mô hình dự đoán xu hướng về doanh thu, hành vi khách hàng, tồn kho, giá cả sản phẩm, giúp doanh nghiệp ra quyết định kịp thời và chính xác.","Trình độ học vấn: Tốt nghiệp đại học chuyên ngành Hệ thống thông tin/Công nghệ thông tin, Toán thống kê, hoặc các lĩnh vực liên quan. Kinh nghiệm làm việc: Tối thiểu 3-5 năm kinh nghiệm trong lĩnh vực Data Analysis và xây dựng hệ thống BI Portal. Có kinh nghiệm tổ chức và tích hợp dữ liệu từ nhiều nguồn khác nhau vào cơ sở dữ liệu chung. Có khả năng làm việc như Business Analyst (BA) , thu thập yêu cầu và chuyển hóa thành giải pháp phân tích dữ liệu. Kỹ năng và kiến thức chuyên môn: Thành thạo các công cụ phân tích và trực quan hóa dữ liệu như: Power BI, Tableau, Looker . Kỹ năng lập trình Python, excel để xử lý và phân tích dữ liệu. Hiểu biết về API và quy trình ETL để tổ chức và tích hợp dữ liệu từ nhiều hệ thống. Kỹ năng phân tích dữ liệu chuyên sâu, cung cấp insight về bán hàng, sản phẩm, khách hàng . Ưu tiên: Có hiểu biết về AI và khả năng xây dựng mô hình dự đoán các xu thế về doanh thu, tồn kho, khách hàng và giá cả sản phẩm là một lợi thế lớn. Yêu cầu khác: Kỹ năng giao tiếp, tư duy logic và giải quyết vấn đề tốt. Tinh thần làm việc độc lập và khả năng phối hợp nhóm hiệu quả.",Nhân viên,Nhân viên chính thức,3 - 4 Năm,"CNTT - Phần cứng / Mạng , CNTT - Phần mềm , Thống kê",30000000.0,47000000.0,3.0,4.0,"Education level: Graduated from university majoring in information/information technology, statistical math, or related fields.Work experience: At least 3-5 years of experience in the field of data Analysis and building a Portal Bi system.Experience in organizing and integrating data from many different sources into the general database.Able to work as Business Analyst (BA), collect requirements and transform into data analysis solutions.Skills and professional knowledge: Proficient in data analysis and visualization tools such as: Power Bi, TableAu, Looker.Python, Excel programming skills to process and analyze data.Understanding API and ETL process to organize and integrate data from multiple systems.Intensive data analysis skills, providing insight for sales, products, customers.Priority: AI knowledge and ability to build a model of predicting trends in revenue, inventory, customers and product prices are a great advantage.Other requirements: Communication skills, logical thinking and good problem solving.The spirit of working independently and the ability to coordinate the group effectively.",['Communication'],"['Looker', 'Power BI', 'Tableau', 'ETL', 'Excel', 'Python']","['Education', 'Information Technology', 'Inventory', 'Sales', 'Technology']"
Chuyên Viên Cao Cấp Mô Hình Hóa Và Phân Tích Nâng Cao - Senior Data Scientist - Modeling Và Advanced Analytics - Khối Dữ Liệu (Holt.08),Ngân Hàng Tmcp Quân Đội,Hà Nội,Cạnh Tranh,2025-03-20,https://careerviet.vn/vi/tim-viec-lam/chuyen-vien-cao-cap-mo-hinh-hoa-va-phan-tich-nang-cao-senior-data-scientist-modeling-va-advanced-analytics-khoi-du-lieu-holt-08.35C39A1E.html,2025-04-19,"['Chế độ bảo hiểm', 'Du Lịch', 'Phụ cấp']","Dẫn dắt việc thiết kế, phát triển và triển khai các mô hình rủi ro (chấm điểm tín dụng, xác định hạn mức …) và mô hình kinh doanh (Nhu cầu khách hàng, dự đoán KH rời bỏ và mục tiêu chiến dịch …). Hướng dẫn kỹ thuật cho các chuyên viên phân tích cấp dưới và các nhóm làm việc đa chức năng. Thúc đẩy việc áp dụng các kỹ thuật phân tích nâng cao, bao gồm AI/ML, để nâng cao khả năng mô hình hóa. Hợp tác với các bên liên quan nội bộ (Rủi ro, Kinh doanh, CNTT) để điều chỉnh các giải pháp mô hình hóa phù hợp với các mục tiêu của tổ chức. Quản lý các quan hệ đối tác chiến lược, bao gồm một sáng kiến nghiên cứu với một trong những trường đại học hàng đầu thế giới, để đổi mới các phương pháp mô hình hóa. Trao đổi, diễn giải những hiểu biết, giả định và ý nghĩa của mô hình một cách hiệu quả cho ban lãnh đạo cấp cao và các bên liên quan trong kinh doanh","Bằng Cử nhân/ Thạc sĩ về Khoa học Dữ liệu, Thống kê, Toán học Ứng dụng, Khoa học Máy tính hoặc lĩnh vực liên quan. 3+ năm kinh nghiệm trong mô hình hóa rủi ro, phân tích kinh doanh hoặc lĩnh vực tương tự. Thông thạo nâng cao về Python, R, SAS, SQL, Spark. Chuyên môn về mô hình thống kê, thuật toán máy học và trực quan hóa dữ liệu. Kinh nghiệm với các nền tảng đám mây (AWS, GCP hoặc Azure) và hệ sinh thái dữ liệu lớn. Khả năng lập luận logic mạnh mẽ và khả năng giải quyết các vấn đề phân tích phức tạp. Kỹ năng ưu tiên: Hiểu biết sâu sắc về các sản phẩm ngân hàng và quản lý rủi ro tín dụng. Kinh nghiệm quản lý các hợp tác nghiên cứu hoặc học thuật. Bạn Nên Khám Phá Thêm: Chuyên viên Mô hình và Phân tích nâng cao - Data Scientist - Modeling và Advanced Analytics - Khối Dữ liệu (HOLT.07): https://tuyendung.mbbank.com.vn/tim-viec-lam/HOLT07/vi Chuyên viên, Chuyên viên Cao cấp Phân tích Khách hàng cá nhân - Data Analysis (Retail Banking) - Khối Dữ liệu (HO25.58): https://tuyendung.mbbank.com.vn/tim-viec-lam/HO2558/vi Chuyên viên, Chuyên viên Cao cấp, Chuyên gia Khoa học Dữ liệu - Data Scientist - Khối Dữ liệu (HO25.92): https://tuyendung.mbbank.com.vn/tim-viec-lam/HO2592/vi",Nhân viên,Nhân viên chính thức,Trên 3 Năm,"CNTT - Phần mềm , Ngân hàng , Tài chính / Đầu tư",21716056.0,31750014.0,3.0,5.0,"Bachelor/ Master's degree in data science, statistics, applied mathematics, computer science or related fields.3+ years of experience in risk modeling, business analysis or similar field.Proficient in advanced Python, R, SAS, SQL, Spark.Specialized in statistical model, machine learning algorithm and data visualization.Experience with cloud platforms (AWS, GCP or Azure) and large data ecosystems.Powerful logical argument and ability to solve complex analysis problems.Priority skills: Deep understanding of banking products and credit risk management.Experience in managing research or academic cooperation.You should discover more: Model and advanced analysis - Data Scientist - Modeling and Advanced Analytics - Data block (Holt.07): https://tuyendung.mbbank.com.vn/tim-viec-lam/holt07/Vi Specialist, Senior Analytical Analytical Personal Customer - Data Analysis (Retail Banking) - Data block (HO25.58):https://tuyendung.mbbank.com.vn/tim-viec-lam/ho2558/Vi experts, senior experts, Data Science expert-Data Scientist-Data block (ho25.92): https://tuyendung.mbbank.com.vn/tim-viec-lam/ho2592/Vi",['Risk Management'],"['Data Visualization', 'Statistics', 'Mathematics', 'SQL', 'AWS', 'Azure', 'Machine Learning', 'Python', 'R', 'SAS']","['Banking', 'Banking', 'Computer Science', 'Machine Learning', 'Research', 'Retail', 'Risk Management']"
