Job Title,Company,Location,Salary,Date,Job Link,Expire Date,Welfare,Job Description,Job Requirements,Job Level,Job Type,Experience,Industry,Min_Salary,Max_Salary,exp_min,exp_max,Translated Job Requirements,Soft Skills,Hard Skills,Domains
Data Analyst Manager,Công Ty Cổ Phần Kinh Doanh F88,Hà Nội,Cạnh Tranh,2025-03-09,https://careerviet.vn/vi/tim-viec-lam/data-analyst-manager.35C3236B.html,2025-04-07,"['Laptop', 'Chế độ bảo hiểm', 'Du Lịch']","1. Phân tích yêu cầu nghiệp vụ Đánh giá và tư vấn giải pháp phân tích dữ liệu theo tần suất dựa trên những yêu cầu quan trọng hoặc phức tạp đối với kinh doanh và vận hành Ra quyết định về giải pháp phân tích dữ liệu nâng cao hoặc báo cáo BI đáp ứng yêu cầu nghiệp vụ 2. Định hướng, quyết định việc xây dựng và đảm bảo tính chính xác báo cáo dữ liệu Định hướng và đánh giá/quyết định các công việc liên quan đến hệ thống các báo cáo dữ liệu: - Đánh giá kết quả đầu ra của luồng truy vấn dữ liệu báo cáo Dashboard, phân tích - Đánh giá và lựa chọn/tư vấn các công cụ nâng cao (Python, R, các thuật toán phân tích dữ liệu...) để phân tích và nhận diện xu hướng, pattern và những mối quan hệ của dữ liệu để hỗ trợ việc đưa ra quyết định kinh doanh hoặc vận hành Định hướng và phân công đầu mối làm việc với các đơn vị Định hướng các dự án về phát triển, nâng cấp, triển khai và phát hành chức năng hoặc hệ thống báo cáo dữ liệu 3. Đề xuất giải pháp Kinh doanh Đánh giá và lựa chọn giải pháp toàn diện, mang tính lâu dài dựa trên dữ liệu để giải quyết được các vấn đề của kinh doanh 4. Phát triển con người Lập kế hoạch nguồn lực con người & ngân sách đảm bảo đáp ứng yêu cầu về sản phẩm, dữ liệu Chịu trách nhiệm và ra quyết định tuyển dụng và đánh giá, phản hồi liên tục đối với CBNV thuộc quản lý Xây dựng kế hoạch và triển khai đào tạo, phát triển năng lực cho mảng chuyên môn nghiệp vụ phụ trách","Tối thiểu 03 năm kinh nghiệm tại các vị trí tương đương (Phụ trách team Data Analyst, Data Analyst Manager...), phụ trách từ 06 nhân sự trở lên Có tư duy về dữ liệu và đam mê về phân tích dữ liệu Có kiến thức sâu sắc về xây dựng báo cáo Dashboard, phân tích dữ liệu đa chiều Có kiến thức sâu sắc về công cụ truy vấn dữ liệu (SQL) và các hệ thống dữ liệu có cấu trúc như Oracle, MySQL, MSSQL, PostgreSQL... Có kinh nghiệm sử dụng một trong số các ngôn ngữ xử lý, tổng hợp và phân tích dữ liệu như Python, R hoặc Julia Có kỹ năng tốt với MS Office như Excel, Word, PowerPoint hoặc các sản phẩm của Google Office (Sheet, Slide...)",Quản lý,Nhân viên chính thức,Trên 5 Năm,CNTT - Phần mềm,21716056.0,31750014.0,5.0,5.0,"Tối thiểu 03 năm kinh nghiệm tại các vị trí tương đương (Phụ trách team Data Analyst, Data Analyst Manager...), phụ trách từ 06 nhân sự trở lên Có tư duy về dữ liệu và đam mê về phân tích dữ liệu Có kiến ​​thức sâu sắc về xây dựng báo cáo Dashboard, phân tích dữ liệu đa chiều Có kiến ​​thức sâu sắc về công cụ truy vấn dữ liệu (SQL) và các hệ thống dữ liệu có cấu trúc như Oracle, MySQL,MSSQL, Postgresql ... Experience using one of the languages ​​processing, synthesizing and analyzing data such as Python, R or Julia with good skills with MS Office such as Excel, Word, PowerPoint or Google Office products (Sheet, Slide ...)",[],"['Dashboard', 'PowerPoint', 'PostgreSQL', 'SQL', 'Excel', 'Python', 'R', 'Julia']",[]
Chuyên Viên Data Analyst,Công Ty Cổ Phần Vacxin Việt Nam,Hồ Chí Minh,12 Tr - 15 Tr Vnd,2025-02-28,https://careerviet.vn/vi/tim-viec-lam/chuyen-vien-data-analyst.35C35E0D.html,unknown,"['Chế độ bảo hiểm', 'Du Lịch', 'Chế độ thưởng']","- Thu thập, làm sạch, chuẩn hóa, đảm bảo dữ liệu chính xác - Vận hành báo cáo đúng giờ, khắc phục lỗi trong quá trình vận hành - Hỗ trợ người dủng cuối khi có yêu cầu - Thực hiện kiểm nghiệm dự án trước khi dự án vận hành - Thu thập, đánh giá nhu cầu người dung và để xuất cải thiện, phát triển báo cáo - Có kinh nghiệm tham gia các dự án tự động hóa vừa và nhỏ. - Có kiến thức và kinh nghiệm về phân tích tình hình kinh doanh - Có kinh nghiệm làm việc với dữ liệu lớn - CÓ kinh nghiệm về UX. UI - Nghiên cứu, đề xuất, phát triển, tối ưu báo cáo có sẵn - Thực hiện các công việc khác theo phân công.","- Tốt nghiệp đại học khối ngành kinh tế hoặc các ngành có liên quan - Ưu tiên ứng viên làm việc trong ngành dịch vụ, bán lẻ - Kinh nghiệm 2 năm xử lý data và làm báo cáo trên Power BI - Thành thạo Microsoft Excel, Power Query, Power BI, SQL, Power Point, Google Slide, Canva - Có kinh nghiệm Appscript và Python là điểm cộng - Trung thực, chăm chỉ, tư duy, khả năng làm việc độc lập cao và khả năng giải quyết vấn đề, không ngại học hỏi cái mới",Nhân viên,Nhân viên chính thức,1 - 2 Năm,"Kế toán / Kiểm toán , Ngân hàng , Tài chính / Đầu tư",12000000.0,15000000.0,1.0,2.0,"- Graduated from University of Economics or related industries - Prioritize candidates working in service and retail industry - 2 -year experience of data processing and reporting on Power Bi - proficient in Microsoft Excel, Power Query, Power Bi, SQL, Power Point, Google Slide, Canva - Experience Appscript and Python are plus points - Honesty, hard -working, high -level, high -working, high -level, high -level, high -level, high -quality, high -quality, high -quality, high -quality, high -endingDe, not afraid to learn new things",[],"['Power BI', 'Power BI', 'SQL', 'Excel', 'Python']","['Economics', 'Retail']"
Marketing & Data Analyst,"Srithai Viet Nam Co., Ltd",Bình Dương,10 Tr - 15 Tr Vnd,2025-03-24,https://careerviet.vn/vi/tim-viec-lam/marketing-data-analyst.35C38B75.html,2025-04-30,"['Laptop', 'Chế độ bảo hiểm', 'Du Lịch']","-Generate regular reports on key metrics, including SALES growth, retention rates, campaign performance, and ROI. -Ensure the accuracy and completeness of MARKETING data by consolidating information from various sources. -Develop dashboards and visualisation tools to present MARKETING performance data in an accessible and actionable format. -Design and set up controlled experiments to test MARKETING hypotheses and strategies. -Analyse test results to identify insights, trends, and opportunities for optimisation. -Collaborate with cross-functional teams to implement learnings from tests and drive continuous improvement. -Ensure data integrity and consistency across different systems and platforms. -Conduct MARKET research to identify industry trends, consumer preferences, and competitive landscape. -Analyse competitor strategies and marketing tactics to identify opportunities and threats. -Provide strategic recommendations based on market insights to drive competitive advantage","Graduating from University or postgraduating in Business Administration, Foreign Economics, Sales and Maketing. Fluent Enghlish and proficient computer. Having good knowledge and experience in plastic injection industry. At least 1 years’ experience in sales and marketing area in medium enterprises or more or foreign invested companies.",Nhân viên,Nhân viên chính thức,1 - 2 Năm,"Bán hàng / Kinh doanh , Thực phẩm & Đồ uống , Tài chính / Đầu tư",10000000.0,15000000.0,1.0,2.0,"Graduating from University or postgraduating in Business Administration, Foreign Economics, Sales and Maketing. Fluent Enghlish and proficient computer. Having good knowledge and experience in plastic injection industry. At least 1 years’ experience in sales and marketing area in medium enterprises or more or foreign invested companies.",[],[],"['Economics', 'Marketing', 'Sales', 'Sales']"
Data Analyst,Công Ty Cổ Phần Canifa,Hà Nội,12 Tr - 25 Tr Vnd,2025-03-20,https://careerviet.vn/vi/tim-viec-lam/data-analyst.35C39A58.html,unknown,"['Laptop', 'Chế độ bảo hiểm', 'Du Lịch']","Sử dụng công cụ để phân tích thông tin của Doanh nghiệp dựa trên hệ thống BI, nguồn dữ liệu sẵn có, trên Internet. Phân tích chân dung, hành vi, nhu cầu tiêu dùng của khách hàng theo yêu cầu Tổng hợp, phân tích, báo cáo chuyên sâu về hàng hóa, điểm bán và đưa ra tư vấn phù hợp Thực hiện các báo cáo, các yêu cầu khác nếu có","Tốt nghiệp Đại học trở lên các chuyên ngành Kinh tế, Marketing, Công nghệ thông tin, Phân tích dữ liệu Tối thiểu 1 năm kinh nghiệm vai trò BI hoặc Phân tích dữ liệu, ưu tiên trong lĩnh vực Bán lẻ/ Thương mại điện tử/ Marketing/ Digital Marketing Có chứng chỉ Phân tích dữ liệu là lợi thế; đọc hiểu Tiếng Anh chuyên ngành. Kỹ năng: tìm kiếm, phân tích, thống kê, tổng hợp dữ liệu; kỹ năng trình bày và giao tiếp; làm việc nhóm và làm việc độc lập; hình ảnh hóa dữ liệu và gợi ý hành động Kiến thức: Bán lẻ/Thương mại điện tử/Marketing Yêu cầu khác: Cẩn thận, tỉ mỉ, chủ động, ham học hỏi",Nhân viên,Nhân viên chính thức,2 - 5 Năm,"Tiếp thị / Marketing , Bán lẻ / Bán sỉ , CNTT - Phần mềm",12000000.0,25000000.0,2.0,5.0,"Graduated from university or higher in economics, marketing, information technology, data analysis at least 1 year of experience in the role of compassion or data analysis, priority in the field of retail/ e -commerce/ marketing/ digital marketing with data analysis certificates as an advantage;Reading English specialized.Skills: Search, analysis, statistics, data synthesis;presentation and communication skills;teamwork and independent work;Image data and suggest knowledge: Retail/e -commerce/Marketing other requirements: Be careful, meticulous, proactive, eager to learn",['Communication'],['Statistics'],"['Digital Marketing', 'Economics', 'Information Technology', 'Marketing', 'Marketing', 'Marketing', 'Marketing', 'Retail', 'Retail', 'Technology']"
Senior Data Business Analyst - Hà Nội,Ngân Hàng Tmcp Việt Nam Thịnh Vượng - Vpbank,Hà Nội,Cạnh Tranh,2025-03-25,https://careerviet.vn/vi/tim-viec-lam/senior-data-business-analyst-ha-noi.35C392FD.html,2025-04-18,"['Chế độ bảo hiểm', 'Du Lịch', 'Phụ cấp']","VPBank hiện là một trong những Ngân hàng có tốc độ tăng trưởng nhanh nhất tại Việt Nam, cung cấp đa dạng các dịch vụ và được nhiều khách hàng tin dùng. VPBank đặc biệt chú ý đến việc nâng cao hiệu quả hoạt động qua việc phân tích các dữ liệu kinh doanh. Vị trí này đóng vai trò: Tối ưu hóa yêu cầu và phát triển tính năng cho các hệ thống dữ liệu của hệ thống kho dữ liệu DWH toàn hàng, các data product khác trên nền tảng dịch vụ quản trị và phân tích dữ liệu của VPbank và Ecosystem, dữ liệu tập trung của EDA và hệ thống báo cáo tuân thủ theo 1 số thông tư của Ngân hàng nhà nước. Phối hợp với SA của các hệ thống nguồn, phân tích chi tiết yêu cầu của nghiệp vụ về dữ liệu phục vụ báo cáo, phân tích, học máy, xây dựng công thức chi tiết từ dữ liệu nguồn tới yêu cầu của người dùng cuối để làm đầu vào cho đội thiết kế lập trình phát triển. Tham gia quản lý BAU và triển khai các dự án và sáng kiến chiến lược liên quan. Nhiệm vụ chi tiết: 1. Chịu trách nhiệm chính trong việc thực thi: - Tiếp nhận, phân tích yêu cầu nghiệp vụ về nhu cầu khai thác và sử dụng số liệu phục vụ cho báo cáo quản trị, báo cáo phân tích, báo cáo tuân thủ, dữ liệu hệ sinh thái. Sử dụng số liệu để tư vấn, kiểm tra tính logic và đầy đủ trong quy tắc tính do nghiệp vụ đưa ra - Quản lý đội nhóm lên kế hoạch và theo dõi tiến độ triển khai công việc (nguồn lực nội bộ phòng, nội bộ khối EDA, nội bộ VPBank hoặc đối tác) - Đưa ra quy tắc kiểm soát vận hành dữ liệu dựa trên logic nghiệp vụ - Xử lý yêu cầu ở mức độ đơn giản tới phức tạp 2. Hỗ trợ gián tiếp (giải thích, làm rõ định nghĩa nghiệp vụ và mapping nguồn) để kỹ sư dữ liệu và cán bộ kiểm thử, vận hành có thể hoàn thành các công việc sau: - Thiết kế giải pháp và mô hình hóa dữ liệu cho từng CR (Change request) nhằm đáp ứng yêu cầu nghiệp vụ - Thiết kế chi tiết các tầng dữ liệu logic cho từng CR trên các phân vùng dữ liệu của DPC quản lý nhằm đáp ứng yêu cầu nghiệp vụ. Thực hiện lập trình phát triển, kiểm thử, golive và vận hành hệ thống - Quản lý, phát triển, vận hành nền tảng công nghệ (hệ thống CSDL, công cụ báo cáo self-service), thực hiện vá lỗi, nâng cấp, cài đặt triển khai các tầng ứng dụng, bảo trì hệ thống dịch vụ -Nghiên cứu phát triển các giải pháp, công nghệ mới liên quan tới Quản lý dữ liệu. Triển khai các sáng kiến chiến lược trên nền tảng công nghệ mới phục vụ cho việc duy trì ổn định và nâng cao dịch vụ thiết kế và quản lý dữ liệu - Tổ chức liên tục cải tiến tối ưu về mặt thiết kế, góp phần làm giảm thời gian xử lý dữ liệu trên các hệ thống dữ liệu - Kiểm thử dữ liệu và hệ thống 3. Hỗ trợ, cùng tham gia trực tiếp triển khai, được tham vấn ý kiến để hoàn thành các công việc: - Hỗ trợ phân tích lỗi xảy ra trong quá trình vận hành dữ liệu, từ đó tham vấn cho các đơn vị nghiệp vụ và khối CNTT về giải pháp xử lý khắc phục. Kiểm tra kết quả sau khi khắc phục - Tham gia điều phối nhóm triển khai các yêu cầu liên quan tới nhiều đơn vị phòng ban, khối. Trao đổi và tư vấn về định hướng quy hoạch sản phẩm dữ liệu","- Đại học hoặc cao hơn liên quan đến 1 trong các ngành kinh tế, tài chính, ngân hàng, hoặc công nghệ thông tin, khoa học máy tính, toán tin ứng dụng - Tối thiểu 3-5 năm trong lĩnh vực quản lý dữ liệu/báo cáo/phân tích/học máy - Kinh nghiệm và kiến thức về truy vấn, tổ chức, phân tích dữ liệu, phân tích yêu cầu nghiệp vụ chi tiết, xây dựng từ điển thuật ngữ nghiệp vụ ngân hàng - Kinh nghiệm và kỹ năng tư vấn tối ưu luồng logic nghiệp vụ, kiểm thử dữ liệu và logic và triển khai cùng và quản lý đối tác công nghệ thông tin - Kỹ năng giao tiếp (lắng nghe, diễn đạt), lập trình dữ liệu, quản lý nhóm và tiến độ - Tư duy logic, tự học hỏi phát triển, làm việc dưới áp lực cao Quyền lợi: - Thu nhập hấp dẫn, lương thưởng cạnh tranh theo năng lực (16 - 18 tháng lương) - Thưởng các Ngày lễ, Tết (theo chính sách ngân hàng từng thời kỳ) - Được vay ưu đãi theo chính sách ngân hàng từng thời kỳ - Chế độ ngày phép hấp dẫn theo cấp bậc công việc - Bảo hiểm bắt buộc theo luật lao động + Bảo hiểm VPBank care cho CBNV tùy theo cấp bậc và thời gian công tác - Được tham gia các khóa đào tạo tùy thuộc vào Khung đào tạo cho từng vị trí - Thời gian làm việc: từ thứ 2 – thứ 6 & 02 sáng thứ 7/ tháng - Môi trường làm việc năng động, thân thiện, có nhiều cơ hội học đào tạo, học hỏi và phát triển; được tham gia nhiều hoạt động văn hóa thú vị (cuộc thi về thể thao, tài năng, hoạt động teambuiding...)",Nhân viên,Nhân viên chính thức,3 - 5 Năm,"CNTT - Phần mềm , Ngân hàng , Quản lý chất lượng (QA/QC)",21716056.0,31750014.0,3.0,5.0,"- University or higher regarding one of the economic, financial, banking, or information technology, computer science, application information - minimum 3-5 years in the field of data management/reporting/analysis/machine learning - Experience and knowledge of query, organization, data analysis, detailed analysis of detailed operations, Building the Skills of Banking and Banking Skills, Banking and Experienced Skillslogic and deployment and management of information technology partners - communication skills (listening, expressing), data programming, group management and progress - Logic thinking, self -study development, working under high pressure on rights: - Attractive income, competitive salary according to capacity (16 - 18 months salary) - Bonuses on holidays, New Year (according to the Banking Banking policies in each period)The level of work - compulsory insurance under the Labor Law + VPBank Care Insurance for employees depending on the rank and working time - participating in training courses depending on the training framework for each position - Working time: From Monday - Friday & February 7/ Month - Active working environment, friendly, with many opportunities for training, learning and development;participate in many interesting cultural activities (competitions on sports, talents, teambuiding activities ...)","['Communication', 'Listening']","['Data Management', 'Machine Learning']","['Banking', 'Banking', 'Banking', 'Banking', 'Banking', 'Banking', 'Computer Science', 'Information Technology', 'Information Technology', 'Insurance', 'Insurance', 'Law', 'Machine Learning', 'Technology', 'Technology']"
Data Analyst (Da),Công Ty Tnhh Mtv Sen Vàng Việt Nam,Hồ Chí Minh,Cạnh Tranh,2025-03-03,https://careerviet.vn/vi/tim-viec-lam/data-analyst-da.35C36946.html,2025-04-01,"['Chế độ bảo hiểm', 'Du Lịch', 'Phụ cấp']","Thu thập, phân tích và trực quan hóa dữ liệu từ các hệ thống sản xuất, kho hàng và bán hàng để đưa ra các phân tích chính xác. Xây dựng các bộ tiêu chí báo cáo cho các phòng ban, báo cáo quản trị cho BOD. Xây dựng các báo cáo thường xuyên về hiệu suất sản xuất, tình hình tồn kho và dữ liệu bán hàng. Hợp tác với BA và đội ngũ phát triển để tạo ra các mô hình phân tích và dự báo. Thực hiện các báo cáo được giao. Thực hiện những nhiệm vụ khác được giao bởi cấp Quản lý trực tiếp và Ban Giám đốc.","Tốt nghiệp cao đẳng/đại học các chuyên ngành như Khoa học dữ liệu, Toán học, Thống kê, Công nghệ thông tin hoặc các ngành liên quan. Có 2-3 năm kinh nghiệm làm việc với phân tích dữ liệu, ưu tiên trong môi trường sản xuất hoặc thương mại điện tử. Thành thạo các công cụ phân tích dữ liệu như Excel, SQL, Power BI, Tableau Hiểu biết tốt về các mô hình dữ liệu và khả năng phân tích dữ liệu lớn (Big Data). Kỹ năng giao tiếp tốt, có khả năng trình bày kết quả phân tích cho các bên liên quan. Tin học văn phòng tốt Có khả năng ra quyết định và có khả năng phân tích tốt. Có khả năng làm việc độc lập, làm việc theo nhóm và khả năng chịu áp lực cao.",Nhân viên,Nhân viên chính thức,2 - 3 Năm,"CNTT - Phần mềm , CNTT - Phần cứng / Mạng",21716056.0,31750014.0,2.0,3.0,"Graduated from college/universities such as data science, mathematics, statistics, information technology or related industries.There are 2-3 years of working experience with data analysis, priority in production or e-commerce environment.Proficient in data analysis tools such as Excel, SQL, Power Bi, Tableeau well understood the data models and large data analysis (Big Data).Good communication skills, capable of presenting analytical results to related parties.Good office information technology is capable of making decisions and has good analysis.Ability to work independently, teamwork and high pressure.",['Communication'],"['Power BI', 'Statistics', 'Mathematics', 'SQL', 'Excel']","['Information Technology', 'Information Technology', 'Technology', 'Technology']"
Marketing Analyst Senior,Công Ty Tnhh Fedex Express Việt Nam,Hồ Chí Minh,Cạnh Tranh,2025-03-21,https://careerviet.vn/vi/tim-viec-lam/marketing-analyst-senior.35C341FA.html,2025-04-19,"['Chế độ bảo hiểm', 'Du Lịch', 'Chế độ thưởng']","Support regional and local management by conducting and supporting analysis for marketing strategy related studies and planning (feasibility study, new products and services, customer/market analysis and/or flight scheduling) to identify revenue and growth opportunities Enhance customer experience by being the Voice-Of-Customer and effectively measure business performance Lead/Support Go-To-Market activities and programs to grow market share Manage the process of development/execution of the Strategic Projects Research and analyze data to develop Management reports. Track, monitor and provide progress updates/overview of the various strategic projects.","Bachelor Degree in Marketing, Finance/Economics, Business, Engineering or a related analytical field. 5 years of experience in marketing development, planning and quantitative business analysis or a related field with proven results in quantitative research preferred Preferably with 3 to 5 years of project management experience Good knowledge of mathematics and/or economics with numerate acumen Possess strong interpersonal, quantitative, problem-solving ability and data analysis skills Demonstrate strong knowledge of Microsoft Word, Powerpoint and Excel capabilities Excellent communication to deal with various levels in the organization Background in Power BI dashboard development and database applications (such as SQL) would be advantageous.",Nhân viên,Nhân viên chính thức,Lên Đến 5 Năm,"Tiếp thị / Marketing , Bán hàng / Kinh doanh , Vận chuyển / Giao nhận / Kho vận",21716056.0,31750014.0,0.0,5.0,"Bachelor Degree in Marketing, Finance/Economics, Business, Engineering or a related analytical field. 5 years of experience in marketing development, planning and quantitative business analysis or a related field with proven results in quantitative research preferred Preferably with 3 to 5 years of project management experience Good knowledge of mathematics and/or economics with numerate acumen Possess strong interpersonal, quantitative, problem-solving ability and data analysis skills Demonstrate strong knowledge of Microsoft Word, Powerpoint and Excel capabilities Excellent communication to deal with various levels in the organization Background in Power BI dashboard development and database applications (such as SQL) would be advantageous.","['Communication', 'Interpersonal']","['Dashboard', 'Power BI', 'PowerPoint', 'Mathematics', 'Quantitative Research', 'SQL', 'Excel']","['Economics', 'Economics', 'Finance', 'Marketing', 'Marketing', 'Project Management', 'Research']"
